[
  {
    "slice": "main",
    "id": "df-01",
    "query": "health ODA grants from USA to Ethiopia",
    "entry_path": "raw_text",
    "tags": [
      {
        "behaviour": "definite"
      },
      {
        "domain": "development_finance"
      },
      {
        "seam": "both"
      },
      {
        "conjunction": "none"
      }
    ],
    "expected_status": "definite",
    "expected_shape": {
      "population_type_dcid": "DevelopmentFinance",
      "measured_property_dcid": "DevelopmentFinanceFlow",
      "stat_type_dcid": "measuredValue",
      "measurement_qualifier_dcid": null,
      "measurement_denominator_dcid": null
    },
    "expected_slots": [
      {
        "axis": "what",
        "property_dcid": "DevelopmentFinanceScheme",
        "binding_kind": "value",
        "value_dcid": "ODAGrants"
      },
      {
        "axis": "how",
        "property_dcid": "DevelopmentFinancePurpose",
        "binding_kind": "value",
        "value_dcid": "DAC/Health"
      },
      {
        "axis": "where",
        "property_dcid": "DevelopmentFinanceRecipient",
        "binding_kind": "value",
        "value_dcid": "country/ETH"
      }
    ],
    "expected_stat_vars": [
      "ONE/CRS_DAC/Health-ODAGrants-ETH"
    ],
    "expected_entities": [
      {
        "dcid": "country/USA",
        "role_kind": "directional",
        "direction": "from",
        "role_dcid": "observationAbout"
      },
      {
        "dcid": "country/ETH",
        "role_kind": "directional",
        "direction": "to",
        "role_dcid": "DevelopmentFinanceRecipient"
      }
    ],
    "expected_no_data_reason": null,
    "candidate_count": null,
    "status": "VERIFIED_AGAINST_GRAPH",
    "notes": "Probed staging. SV ONE/CRS_DAC/Health-ODAGrants-ETH confirmed: populationType=DevelopmentFinance,\nmeasuredProperty=DevelopmentFinanceFlow, statType=measuredValue, DevelopmentFinanceScheme=ODAGrants,\nDevelopmentFinancePurpose=DAC/Health (rollup node \"Health Total\"), DevelopmentFinanceRecipient=country/ETH.\nObservation probe: country/USA as observationAbout yields 402 observations, date range 1991-2024 (18 facets).\ncountry/USA and country/ETH both confirmed as valid entity dcids.\nDAC/Health confirmed as a DevelopmentFinancePurposeEnum node (CRS purpose code 12000).\nODAGrants confirmed as a Property node (Official Development Assistance Grants).\nSeam-ON (rendered above): donor country/USA is role_kind=directional direction=from, role_dcid=observationAbout (observation-sourced);\nrecipient country/ETH is role_kind=directional direction=to bound via DevelopmentFinanceRecipient constraint.\nSeam-OFF rendering: both entities become role_kind=subject with direction=null and role_dcid=null;\nthe offline seam replay (tests/engine/test_seam_corpus.py) asserts this role collapse against fixtures in both modes.\n[conformance: named donor is a directional 'from' role sourced from observationAbout, symmetric with the recipient's directional 'to'; supersedes the earlier Rule-6 subject treatment per place-as-constraint-seam.md]\n"
  },
  {
    "slice": "main",
    "id": "df-03",
    "query": "health ODA grants from UK to Kenya",
    "entry_path": "raw_text",
    "tags": [
      {
        "behaviour": "definite"
      },
      {
        "domain": "development_finance"
      },
      {
        "seam": "both"
      },
      {
        "conjunction": "none"
      }
    ],
    "expected_status": "definite",
    "expected_shape": {
      "population_type_dcid": "DevelopmentFinance",
      "measured_property_dcid": "DevelopmentFinanceFlow",
      "stat_type_dcid": "measuredValue",
      "measurement_qualifier_dcid": null,
      "measurement_denominator_dcid": null
    },
    "expected_slots": [
      {
        "axis": "how",
        "property_dcid": "DevelopmentFinancePurpose",
        "binding_kind": "value",
        "value_dcid": "DAC/Health"
      },
      {
        "axis": "what",
        "property_dcid": "DevelopmentFinanceScheme",
        "binding_kind": "value",
        "value_dcid": "ODAGrants"
      },
      {
        "axis": "where",
        "property_dcid": "DevelopmentFinanceRecipient",
        "binding_kind": "value",
        "value_dcid": "country/KEN"
      }
    ],
    "expected_stat_vars": [
      "ONE/CRS_DAC/Health-ODAGrants-KEN"
    ],
    "expected_entities": [
      {
        "dcid": "country/KEN",
        "role_kind": "directional",
        "direction": "to",
        "role_dcid": "DevelopmentFinanceRecipient"
      },
      {
        "dcid": "country/GBR",
        "role_kind": "directional",
        "direction": "from",
        "role_dcid": "observationAbout"
      }
    ],
    "expected_no_data_reason": null,
    "candidate_count": null,
    "status": "VERIFIED_AGAINST_GRAPH",
    "notes": "Probed ONE/CRS_DAC/Health-ODAGrants-KEN on staging: confirmed 3 constraintProperties (DevelopmentFinancePurpose=DAC/Health, DevelopmentFinanceScheme=ODAGrants, DevelopmentFinanceRecipient=country/KEN), populationType=DevelopmentFinance, measuredProperty=DevelopmentFinanceFlow, statType=measuredValue. obs probe for (variable=ONE/CRS_DAC/Health-ODAGrants-KEN, entity=country/GBR) returned 432 observations spanning 1988-2024 across 18 facets -- fully live. country/GBR (UK) and country/KEN (Kenya) both confirmed as valid entity dcids. Seam-ON rendering: country/GBR is role_kind=directional direction=from, role_dcid=observationAbout (observation-sourced); country/KEN is role_kind=directional direction=to via DevelopmentFinanceRecipient constraint. Seam-OFF rendering: country/KEN becomes role_kind=subject (no directional), country/GBR becomes role_kind=subject (no directional); the offline seam replay asserts this role collapse. [conformance: named donor is a directional 'from' role sourced from observationAbout, symmetric with the recipient's directional 'to'; supersedes the earlier Rule-6 subject treatment per place-as-constraint-seam.md]\n"
  },
  {
    "slice": "main",
    "id": "df-04",
    "query": "health official development assistance from Germany to Ethiopia",
    "entry_path": "raw_text",
    "tags": [
      {
        "behaviour": "definite"
      },
      {
        "domain": "development_finance"
      },
      {
        "seam": "both"
      },
      {
        "conjunction": "none"
      }
    ],
    "expected_status": "definite",
    "expected_shape": {
      "population_type_dcid": "DevelopmentFinance",
      "measured_property_dcid": "DevelopmentFinanceFlow",
      "stat_type_dcid": "measuredValue",
      "measurement_qualifier_dcid": null,
      "measurement_denominator_dcid": null
    },
    "expected_slots": [
      {
        "axis": "what",
        "property_dcid": "DevelopmentFinanceScheme",
        "binding_kind": "value",
        "value_dcid": "OfficialDevelopmentAssistance"
      },
      {
        "axis": "how",
        "property_dcid": "DevelopmentFinancePurpose",
        "binding_kind": "value",
        "value_dcid": "DAC/Health"
      },
      {
        "axis": "where",
        "property_dcid": "DevelopmentFinanceRecipient",
        "binding_kind": "value",
        "value_dcid": "country/ETH"
      }
    ],
    "expected_stat_vars": [
      "ONE/CRS_DAC/Health-OfficialDevelopmentAssistance-ETH"
    ],
    "expected_entities": [
      {
        "dcid": "country/DEU",
        "role_kind": "directional",
        "direction": "from",
        "role_dcid": "observationAbout"
      },
      {
        "dcid": "country/ETH",
        "role_kind": "directional",
        "direction": "to",
        "role_dcid": "DevelopmentFinanceRecipient"
      }
    ],
    "expected_no_data_reason": null,
    "candidate_count": null,
    "status": "VERIFIED_AGAINST_GRAPH",
    "notes": "Probed ONE/CRS_DAC/Health-OfficialDevelopmentAssistance-ETH on staging: confirmed\npopulationType=DevelopmentFinance, measuredProperty=DevelopmentFinanceFlow,\nstatType=measuredValue, DevelopmentFinanceScheme=OfficialDevelopmentAssistance,\nDevelopmentFinancePurpose=DAC/Health, DevelopmentFinanceRecipient=country/ETH.\nConfirmed 372 observations (1997-2024) with country/DEU as observationAbout donor.\nDAC/Health confirmed as aggregate rollup node (name \"Health (Total)\", isPartOf parent\nfor DAC/BasicHealth etc.); binding_kind=value on the how axis because DAC/Health is\na real aggregate node, not a set. country/ETH as subject yields 0 observations,\nconfirming ETH is the constraint (DevelopmentFinanceRecipient), not the donor.\nOfficialDevelopmentAssistance confirmed as aggregate scheme (grants+loans combined).\nSeam-OFF rendering: country/ETH becomes role_kind subject with no directional role;\nthis would fail to find data as ETH is a constraint value, not observationAbout.\nSeam-ON rendering shown above: country/DEU is role_kind=directional direction=from, role_dcid=observationAbout (observation-sourced);\ncountry/ETH is directional to/DevelopmentFinanceRecipient constraint.\n[conformance: named donor is a directional 'from' role sourced from observationAbout, symmetric with the recipient's directional 'to'; supersedes the earlier Rule-6 subject treatment per place-as-constraint-seam.md]\n"
  },
  {
    "slice": "main",
    "id": "df-05",
    "query": "HIV/AIDS ODA grants from USA to Kenya",
    "entry_path": "raw_text",
    "tags": [
      {
        "behaviour": "definite"
      },
      {
        "domain": "development_finance"
      },
      {
        "seam": "both"
      },
      {
        "conjunction": "none"
      }
    ],
    "expected_status": "definite",
    "expected_shape": {
      "population_type_dcid": "DevelopmentFinance",
      "measured_property_dcid": "DevelopmentFinanceFlow",
      "stat_type_dcid": "measuredValue",
      "measurement_qualifier_dcid": null,
      "measurement_denominator_dcid": null
    },
    "expected_slots": [
      {
        "axis": "how",
        "property_dcid": "DevelopmentFinancePurpose",
        "binding_kind": "value",
        "value_dcid": "DAC/STDcontrolincludingHIVAIDS"
      },
      {